{
  "job_id": "6f1c1a2e-9d0b-4a8e-8c1e-2f3d4e5f6a7b",
  "design_id": "0b8e7c6d-5a4b-4c3d-9e2f-1a0b9c8d7e6f",
  "version_no": 1,
  "template": { "id": "jharokha_phone_stand", "version": 1 },
  "spec": {
    "spec_version": "1.0",
    "family": "phone_stand",
    "template": "jharokha_phone_stand@1",
    "params": { "width_mm": 92, "depth_mm": 78, "height_mm": 120, "tilt_deg": 70, "lip_height_mm": 12, "wall_mm": 3.2, "arch_cusps": 5 },
    "features": [],
    "style": "none",
    "material": "terracotta_silk",
    "constraints": { "min_wall_mm": 1.2, "max_overhang_deg": 55, "bed_mm": [250, 250, 250] }
  },
  "assets": {
    "glb": { "key": "designs/0b8e7c6d-5a4b-4c3d-9e2f-1a0b9c8d7e6f/v1/model.glb", "url": "http://localhost:8081/assets/designs/0b8e7c6d-5a4b-4c3d-9e2f-1a0b9c8d7e6f/v1/model.glb", "bytes": 184320, "content_type": "model/gltf-binary" },
    "3mf": { "key": "designs/0b8e7c6d-5a4b-4c3d-9e2f-1a0b9c8d7e6f/v1/model.3mf", "url": "http://localhost:8081/assets/designs/0b8e7c6d-5a4b-4c3d-9e2f-1a0b9c8d7e6f/v1/model.3mf", "bytes": 98304, "content_type": "model/3mf" },
    "stl": { "key": "designs/0b8e7c6d-5a4b-4c3d-9e2f-1a0b9c8d7e6f/v1/model.stl", "url": "http://localhost:8081/assets/designs/0b8e7c6d-5a4b-4c3d-9e2f-1a0b9c8d7e6f/v1/model.stl", "bytes": 512000, "content_type": "model/stl" }
  },
  "printability": {
    "report_version": "1.0",
    "passed": true,
    "geometry": { "bounds_mm": [92, 78, 120], "volume_cm3": 41.8, "surface_cm2": 612.4, "triangles": 4210 },
    "checks": {
      "manifold": { "status": "pass", "summary": "Watertight", "value": true },
      "fits_bed": { "status": "pass", "summary": "Fits 250 × 250 × 250 mm bed", "value": true },
      "thinnest_wall": { "status": "pass", "summary": "3.2 mm · safe", "value": 3.2, "unit": "mm", "threshold": 1.2 },
      "centre_of_gravity": { "status": "pass", "summary": "Inside base · 3 mm", "value": 3.0, "unit": "mm" },
      "tipping_margin": { "status": "pass", "summary": "Stable", "value": 21.5, "unit": "mm", "threshold": 5 },
      "overhangs": { "status": "skipped", "summary": "Overhang analysis arrives in Phase 2" },
      "load_capacity": { "status": "skipped", "summary": "Load estimate arrives in Phase 3" }
    },
    "check_duration_ms": 2100
  },
  "print_estimate": {
    "method": "heuristic",
    "print_seconds": 13200,
    "extruded_volume_cm3": 51.6,
    "layer_height_mm": 0.2,
    "infill_pct": 15,
    "layers": 600,
    "supports_required": false
  },
  "karigar_note": "A jharokha-arch phone stand, 92 mm wide with a 12 mm lip. It holds phones up to 6.9 inches.",
  "build_ms": 4300
}
